<?xml version="1.0" encoding="UTF-8"?>
<!--Sample XML file generated by XMLSpy v2008 rel. 2 sp2 (http://www.altova.com)-->
<routePlannerResult xsi:noNamespaceSchemaLocation="http://rcsmobility.com/xsd/routeplanner_result.xsd" xmlns:xsi="http://www.w3.org/2001/XMLSchema-instance">
	<query maxSolutions="4" userProfile="35001" sessionId="123456789ABCDE" siteId="7036874417766401">
		<timeBounds minDepartureHour="2001-12-17T09:30:47.0Z" minArrivalHour="2001-12-17T09:30:47.0Z" maxArrivalHour="2001-12-18T09:30:47.0Z" maxDepartureHour="2001-12-18T11:30:47.0Z"/>
		<places departureCity="TOULOUSE" arrivalCityNameTrust="0.9" departureCityNameTrust="0.7" arrivalStopNameTrust="0.8" arrivalStop="Montparnasse" arrivalCity="PARIS" />
		<transportModeFilter id="2147483647" name="Tous modes"/>
	</query>
	<journeys>
		<journey hasALineAlert="true" hasAStopAlert="false">
			<reservation online="true" type="optional" openingHours="Tous les jours" deadLine="2001-12-16T09:30:47.0Z" phoneNumber="String"/>
			<chunks>
				<transport departureTime="2001-12-17T09:30:47.0Z" arrivalTime="2001-12-17T19:30:47.0Z" length="800000" startStopIsTerminus="true" endStopIsTerminus="true" >
					<startStop latitude="0.0" longitude="0.0" id="1" x="0" y="0" name="Quai 1">
						<connectionPlace latitude="0.0" longitude="0.0" id="1" city="TOULOUSE" x="0" y="0" name="Matabiau">
						</connectionPlace>
					</startStop>
					<endStop latitude="0.0" longitude="0.0" id="2" x="0" y="0" name="Quai 26">
						<connectionPlace latitude="0.0" longitude="0.0" id="2" city="PARIS" x="0" y="0" name="Montparnasse">
						</connectionPlace>
					</endStop>
					<destinationStop id="2" x="0" y="0" name="Quai 26">
						<connectionPlace latitude="0.0" longitude="0.0" id="2" city="PARIS" x="0" y="0" name="Montparnasse">
						</connectionPlace>
					</destinationStop>
					<line id="5675" color="#CCCCCC" cssClass="gris" imgURL="tgv.png" longName="le TGV Atlantique" shortName="TGV">
					<alert id="9834" level="interruption" startValidity="2000-01-01T00:00:07.0Z" endValidity="2099-12-31T23:59:00.0Z">SNCF en grève</alert>
					</line>
					<vehicleType id="456" name="TGV" />
				</transport>
			</chunks>
		</journey>
		<journey hasALineAlert="false" hasAStopAlert="true">
			<reservation online="false" type="compulsory" openingHours="Semaine" deadLine="2001-12-17T09:26:47.0Z" phoneNumber="1234"/>
			<chunks>
				<transport endStopIsTerminus="false" length="256000" startStopIsTerminus="true" departureTime="2001-12-17T17:30:47.0Z" arrivalTime="2001-12-17T17:25:47.0Z" possibleWaitingTime="PT5M">
					<startStop latitude="0.0" longitude="0.0" id="1" x="0" y="0" name="String">
						<connectionPlace latitude="0.0" longitude="0.0" id="1" city="a" x="0" y="0" name="a">
						</connectionPlace>
					</startStop>
					<endStop latitude="0.0" longitude="0.0" id="3" x="0" y="0" name="Quai 6">
						<connectionPlace latitude="0.0" longitude="0.0" id="3" city="BORDEAUX" x="0" y="0" name="Saint-Jean">
							<alert id="1444" startValidity="2001-12-10T09:30:47.0Z" endValidity="2002-12-24T09:30:47.0Z" level="info">Travaux sur le parvis de la gare</alert>
						</connectionPlace>
					</endStop>
					<destinationStop latitude="0.0" longitude="0.0" id="3" x="0" y="0" name="Quai 6">
						<connectionPlace latitude="0.0" longitude="0.0" id="3" city="BORDEAUX" x="0" y="0" name="Saint-Jean">
							<alert id="1444" startValidity="2001-12-10T09:30:47.0Z" endValidity="2002-12-24T09:30:47.0Z" level="info">Travaux sur le parvis de la gare</alert>
						</connectionPlace>
					</destinationStop>
					<line id="123456" color="#C00000" cssClass="red" shortName="C" />
					<vehicleType id="123" name="Bus" />
				</transport>
				<street length="600000" city="BORDEAUX" name="Autoroute A10" departureTime="2001-12-17T17:30:47.0Z" arrivalTime="2001-12-17T17:25:47.0Z">
					<startAddress>
						<connectionPlace latitude="0.0" longitude="0.0" id="1" x="0" y="0" city="BORDEAUX"  name="Saint-Jean"><alert id="1444" startValidity="2001-12-10T09:30:47.0Z" endValidity="2002-12-24T09:30:47.0Z" level="info">Travaux sur le parvis de la gare</alert>
						</connectionPlace>
					</startAddress>
					<endAddress>
						<connectionPlace latitude="0.0" longitude="0.0" id="1" city="PARIS" x="0" y="0" name="Montparnasse">
						</connectionPlace>
					</endAddress>
				</street>
			</chunks>
		</journey>
		<journey hasALineAlert="true" hasAStopAlert="false" continuousServiceDuration="PT1H">
			<reservation online="true" type="compulsory" openingHours="String" deadLine="2001-12-17T09:30:47.0Z" phoneNumber="String"/>
			<chunks>
				<transport endStopIsTerminus="false" startStopIsTerminus="true" length="700000" departureTime="2001-12-17T11:30:47.0Z" endDepartureTime="2001-12-17T12:30:47.0Z" arrivalTime="2001-12-17T21:00:47.0Z" endArrivalTime="2001-12-17T22:00:47.0Z">
					<startStop latitude="0.0" longitude="0.0" id="1" x="0" y="0" name="Quai 4">
						<connectionPlace latitude="0.0" longitude="0.0" id="1" city="TOULOUSE" x="0" y="0" name="Matabiau">
						</connectionPlace>
					</startStop>
					<endStop latitude="0.0" longitude="0.0" id="1" x="0" y="0" name="Quai 17">
						<connectionPlace latitude="0.0" longitude="0.0" id="1" city="PARIS" x="0" y="0" name="Austerlitz">
						</connectionPlace>
					</endStop>
					<destinationStop latitude="0.0" longitude="0.0" id="1" x="0" y="0" name="Quai 17">
						<connectionPlace latitude="0.0" longitude="0.0" id="1" city="PARIS" x="0" y="0" name="Austerlitz">
						</connectionPlace>
					</destinationStop><line id="4599" color="#435863" shortName="10" ></line>
					<vehicleType id="03493" name="Métro" />
				</transport>
				<connection length="0" departureTime="2001-12-17T21:00:47.0Z" arrivalTime="2001-12-17T21:30:47.0Z" endDepartureTime="2001-12-17T22:00:47.0Z" endArrivalTime="2001-12-17T22:30:47.0Z">
					<startStop latitude="0.0" longitude="0.0" id="1" x="0" y="0" name="Parvis">
						<connectionPlace latitude="0.0" longitude="0.0" id="1" city="PARIS" x="0" y="0" name="Austerlitz">
						</connectionPlace>
					</startStop>
					<endStop latitude="0.0" longitude="0.0" id="1" x="0" y="0" name="Parvis">
						<connectionPlace latitude="0.0" longitude="0.0" id="1" city="PARIS" x="0" y="0" name="Montparnasse">
						</connectionPlace>
					</endStop>
				</connection>
			</chunks>
		</journey>
	</journeys>
	<resultTable>
		<row type="departure">
			<cells>
				<cell departureDateTime="2001-12-17T09:30:47.0Z" />
				<cell departureDateTime="2001-12-17T10:30:47.0Z" />
				<cell departureDateTime="2001-12-17T11:30:47.0Z" endDepartureDateTime="2001-12-17T12:30:47.0Z" />
			</cells>
			<place>
				<connectionPlace latitude="0.0" longitude="0.0" id="1" city="a" x="0" y="0" name="a">
				</connectionPlace>
			</place>
		</row>
		<row type="connection">
			<cells>
				<cell />
				<cell departureDateTime="2001-12-17T17:30:47.0Z" arrivalDateTime="2001-12-17T17:25:47.0Z" />
				<cell />
			</cells>
			<place>
				<connectionPlace latitude="0.0" longitude="0.0" id="1" city="BORDEAUX" x="0" y="0" name="Saint-Jean">
					<alert id="1444" startValidity="2001-12-17T07:30:47.0Z" endValidity="2002-12-17T09:30:47.0Z" level="warning">Travaux sur le parvis de la gare</alert>
				</connectionPlace>
			</place>
		</row>
		<row type="connection">
			<cells>
				<cell />
				<cell />
				<cell departureDateTime="2001-12-17T21:00:47.0Z" arrivalDateTime="2001-12-17T21:00:47.0Z" endArrivalDateTime="2001-12-17T22:00:47.0Z"  endDepartureDateTime="2001-12-17T22:00:47.0Z"/>
			</cells>
			<place>
				<connectionPlace latitude="0.0" longitude="0.0" id="1" city="PARIS" x="0" y="0" name="Austerlitz">
				</connectionPlace>
			</place>
		</row>
		<row type="arrival">
			<cells>
				<cell arrivalDateTime="2001-12-17T19:30:47.0Z" />
				<cell arrivalDateTime="2001-12-17T20:30:47.0Z" />
				<cell arrivalDateTime="2001-12-17T21:30:47.0Z" endArrivalDateTime="2001-12-17T22:30:47.0Z"/>
			</cells>
			<place>
				<connectionPlace latitude="0.0" longitude="0.0" id="1" city="PARIS" x="0" y="0" name="Montparnasse">
				</connectionPlace>
			</place>
		</row>
	</resultTable>
</routePlannerResult>
